category,question,option1,option2,option3,option4,correctAnswer,explanation,difficulty
Australia and its people,What is the capital city of Australia?,Canberra,Sydney,Melbourne,Perth,1,Canberra is the capital city of Australia,easy
Australia's democratic beliefs rights and liberties,What is the name of Australia's Parliament?,Federal Parliament,National Parliament,Commonwealth Parliament,Australian Parliament,3,The Commonwealth Parliament is Australia's federal legislature,medium
Government and the law in Australia,What is the role of the High Court?,Interpret laws,Make laws,Enforce laws,All of the above,1,The High Court's primary role is to interpret and apply the law of Australia,medium
Australian values,What is a key Australian value?,Mateship,Individualism,Competition,Hierarchy,1,Mateship and helping others is a key Australian value,easy
Australian Society,What is the national flower of Australia?,Golden Wattle,Waratah,Kangaroo Paw,Sturt's Desert Pea,1,The Golden Wattle (Acacia pycnantha) is Australia's national flower,medium 